<?xml version="1.0" encoding="UTF-8"?>
<xs:schema xmlns:xs="http://www.w3.org/2001/XMLSchema">

  <!-- Root element: Hotels -->
  <xs:element name="Hotels">
    <xs:complexType>
      <xs:sequence>
        <!-- Hotel element (repeated) -->
        <xs:element name="Hotel" maxOccurs="unbounded">
          <xs:complexType>
            <xs:sequence>
              <xs:element name="Name" type="xs:string"/>
              <xs:element name="Address">
                <xs:complexType>
                  <xs:sequence>
                    <xs:element name="Street" type="xs:string"/>
                    <xs:element name="City" type="xs:string"/>
                    <xs:element name="State" type="xs:string"/>
                    <xs:element name="Zip" type="xs:string"/>
                  </xs:sequence>
                </xs:complexType>
              </xs:element>
              <xs:element name="Phone" maxOccurs="unbounded" type="xs:string"/>
              <xs:element name="Rating" type="xs:int"/>
              <xs:element name="NearstAirport" type="xs:string"/>
            </xs:sequence>
            <!-- Optional attribute -->
            <xs:attribute name="optionalAttribute" type="xs:string" use="optional"/>
            <!-- Required attribute -->
            <xs:attribute name="requiredAttribute" type="xs:string" use="required"/>
          </xs:complexType>
        </xs:element>
      </xs:sequence>
    </xs:complexType>
  </xs:element>

</xs:schema>
